stock_name,stock_code,article_date,article_title,article_nickname,article_content,article_comments,article_viewers,article_likes,article_dislikes,article_url,vote_election,vote_candidate,vote_category,vote_start_date,vote_end_date
오리엔트바이오,002630,2022-02-11,짧은 레포트) 무지에 대한 고찰과 총평,ul******,"유명한 관광지의 폭포수 앞에서. 이 쏟아지는 물들을 하늘로 띄워보겠다는 산속의 무속인이 살았다. 저 위 골짜기부터 내려오는 폭포수였기에 사람들은 그 무속인이 헛소리를 하는구나 하고 그냥 지나쳐갔다. 하지만 그 무속인은 세치혀를 이용하여 매일매일 그 앞에서 사람들을 향해 거짓말로 호소하며 현혹시켰다. 보통의 사람들은 그냥 무시하며 지나갔지만 가끔 어쩌다 한명씩 걸려들며 말하기를 ""와 방금 물이 진짜로 하늘로 튀어올랐어!"" 라며 놀라운 표정으로 감탄하는 것이었다. 그런 한두명의 사람들이 어느덧 제법 모여들기 시작했고 그들은 종교가 되었다. 윗층에서 아랫층으로 떨어지는 물줄기의 단편적으로 튀겨오르는 물방울의 단편단편들에 집중하며 정말로 저 무속인이 하늘로 물줄기를 쏘아보내는 힘이 있다고 믿는 집단이었다. 아는만큼 보이고 믿는만큼 이루어질 지어다 적당히 이런 종교적 언어 폐쇄적 단어들로 그들의 정신에 위로를 주었으며 그들은 도태되어갔다. 무릇 사람이란 생각한대로 살지 않으면 사는대로 생각하게 된다. 이들을 관찰하며 많은 생각에 잠기는 밤이 될 것 같다. 총평 끝","['나이아 가라~~ ㅋㅋ 우리도 힘차게 아자~~~~^^', '내 왠만하면 글 안쓸라고했는데, 참으로 명필이라...조중동아 제발좀 일본으로 가라.', '나라 망치는 조중동, 국민이 심판합시다.']",417,11,4,https://finance.naver.com/item/board_read.naver?code=002630&nid=213653255&st=&sw=&page=851,20대,이재명,인맥주,2022-02-05,2022-03-16
오리엔트바이오,002630,2022-02-10,[삭제된 게시물의 답글]오리엔트바이오,cdh1****,토론방은 이게 정감있고 좋은겁니다 맨날 주식야그하고 돈야그 합니까? 개판은 무슨 정겹구만,[],221,0,6,https://finance.naver.com/item/board_read.naver?code=002630&nid=213641295&st=&sw=&page=851,20대,이재명,인맥주,2022-02-05,2022-03-16
오리엔트바이오,002630,2022-02-10,[삭제된 게시물의 답글]근데 신규 찬티들 어디갓어 다? ? ?,cdh1****,나는 찬티는아니지만 한마디 해주께 여기주주 아니면 꺼져라 머러 시간낭비허냐 좀비같은 인생아 막걸리한잔 쳐묵고 디비자라 돈도 없는게 지 랄 은 5천만원어치를하네 ㅎㅎ,['응? 나오랜만에 왓어 나 찾길래ㅋㅋㅋ'],184,4,3,https://finance.naver.com/item/board_read.naver?code=002630&nid=213640449&st=&sw=&page=851,20대,이재명,인맥주,2022-02-05,2022-03-16
오리엔트바이오,002630,2022-02-10,[삭제된 게시물의 답글]근데 신규 찬티들 어디갓어 다? ? ?,cdh1****,그러고보니 나하고 아이디 첫글이 비슷허네 ㅎㅎ,[],130,2,0,https://finance.naver.com/item/board_read.naver?code=002630&nid=213640895&st=&sw=&page=851,20대,이재명,인맥주,2022-02-05,2022-03-16
오리엔트바이오,002630,2022-02-10,[삭제된 게시물의 답글]근데 신규 찬티들 어디갓어 다? ? ?,cdh1****,근데 하나물어보자 여기 몃주갓고있어? 나부터야그하께 난 18만주 지금 마이너스찍어도 두달은 내계좌 빨간불안꺼지는디 ㅎㅎ,['난 130만주'],135,0,2,https://finance.naver.com/item/board_read.naver?code=002630&nid=213641189&st=&sw=&page=851,20대,이재명,인맥주,2022-02-05,2022-03-16
오리엔트바이오,002630,2022-02-10,ㅋㅋ 민주당 망했어 지금ㅋㅋㅋ 선거 끝낫어 증거ㅋ,chan****,다들 뉴스 보고잇지ㅋ 민주당 거짓말 하다가 지금 아므말 못해 증거 자료가 계속 나오니간ㅋㅋㅋ ㅋㅋ 이낙연. 추이애 분열까지ㅋ 매달 150만원 현금출력ㅋㅋ,"['윤무식이 찍느니 차라리 안철수 찍는다', '국힘보단 민주당이 백배낫다고본다 잊ㄷㆍ식1도없는데. 난그래', '고생이 많아 찬아']",267,2,9,https://finance.naver.com/item/board_read.naver?code=002630&nid=213636219&st=&sw=&page=851,20대,이재명,인맥주,2022-02-05,2022-03-16
오리엔트바이오,002630,2022-02-10,ㅋㅋ 민주당 망했어 지금ㅋㅋㅋ 선거 끝낫어 증거ㅋ,cdh1****,니가찬이구나 ㅎㅎ 내가 경상도라서 국힘 골수팬인데 여긴 주식이네 아가리다물고 니머리에만갓고있어라 그생각 나는 이주식 계속 숫자늘 려보께 나중에 누가 승인지보자 답답한 청춘아 ㅎㅎ 밥이라도 쳐묵고 댕겨라,[],152,7,1,https://finance.naver.com/item/board_read.naver?code=002630&nid=213640762&st=&sw=&page=851,20대,이재명,인맥주,2022-02-05,2022-03-16
오리엔트바이오,002630,2022-02-10,형아 바빠 . 여기 끝난 주식이라서,chan****,혀아 3종목 매수 대기 중 이라서 바빠 . 끝난종목이라고 했잖아 여기,[],168,0,5,https://finance.naver.com/item/board_read.naver?code=002630&nid=213628088&st=&sw=&page=851,20대,이재명,인맥주,2022-02-05,2022-03-16
오리엔트바이오,002630,2022-02-10,형아 바빠 . 여기 끝난 주식이라서,jybk****,대가리 피도 안마른 놈이 형이라고??~~ 에라이 써글 ?끼야 ~~ 여기 말고도 세군데나 분탕질 하러 다닌다고?? 넌 정말 한강가야 될 놈이구나~ 아니다. 꼴보기 싫으니 여기서라도 꺼져라~ 끝난 주식이라며~~ 뭐 먹을게 있다고 계속 나불대냐?? 양아 ?끼야 ~~,[],148,6,1,https://finance.naver.com/item/board_read.naver?code=002630&nid=213633840&st=&sw=&page=851,20대,이재명,인맥주,2022-02-05,2022-03-16
오리엔트바이오,002630,2022-02-10,파실분들에게,myji****,"지금 사 줄때 사세여 다시 1115원 8,900주 대기중이예ㅇ",['기다리시오 399'],277,0,0,https://finance.naver.com/item/board_read.naver?code=002630&nid=213609387&st=&sw=&page=851,20대,이재명,인맥주,2022-02-05,2022-03-16
오리엔트바이오,002630,2022-02-10,파실분들에게,cdh1****,대기만 하시는중? ㅎㅎ 난 오늘도 살며시 쫌더 담아봅니다 아무런 걱정이 없네요 ㅎㅎ,[],135,2,0,https://finance.naver.com/item/board_read.naver?code=002630&nid=213631579&st=&sw=&page=851,20대,이재명,인맥주,2022-02-05,2022-03-16
오리엔트바이오,002630,2022-02-10,앞으로 9000주 남았네,myji****,"이제 1115원 매수 대기 8,500주 남았네여 힘내어 팔아 주세요 1115원에 저가 8,900주 매수 대기 중입니다.",[],205,1,0,https://finance.naver.com/item/board_read.naver?code=002630&nid=213605654&st=&sw=&page=851,20대,이재명,인맥주,2022-02-05,2022-03-16
오리엔트바이오,002630,2022-02-10,앞으로 9000주 남았네,myji****,히 빠지니까 팔실분들 아쉽지요 다시 넣어 드릴까요,[],130,0,1,https://finance.naver.com/item/board_read.naver?code=002630&nid=213607407&st=&sw=&page=851,20대,이재명,인맥주,2022-02-05,2022-03-16
오리엔트바이오,002630,2022-02-10,파실분들에게,myji****,시장가로 짝 내놓으셔여 지발 조금씩 그렇게 ㅎ지 말고 전 1100원에 매수 대기하고 있는데,[],158,0,0,https://finance.naver.com/item/board_read.naver?code=002630&nid=213590237&st=&sw=&page=851,20대,이재명,인맥주,2022-02-05,2022-03-16
오리엔트바이오,002630,2022-02-10,파실분들에게,jybk****,난 꼴랑 고기서 오원 밑에 대기~~^^ 근데 며칠째 허탕 ㅠㅠ 내일까지 안사지면 접자 접어~~,[],108,0,0,https://finance.naver.com/item/board_read.naver?code=002630&nid=213596486&st=&sw=&page=851,20대,이재명,인맥주,2022-02-05,2022-03-16
오리엔트바이오,002630,2022-02-10,파실분들에게,myji****,"다시 15원 올려 1115원 8,900주 매수대기 걸어 놓앗음",[],109,0,0,https://finance.naver.com/item/board_read.naver?code=002630&nid=213605116&st=&sw=&page=851,20대,이재명,인맥주,2022-02-05,2022-03-16
오리엔트바이오,002630,2022-02-10,8년 내내 내리막이냐..,blue****,-90% 에휴 답이 안나와,[],199,1,0,https://finance.naver.com/item/board_read.naver?code=002630&nid=213575312&st=&sw=&page=851,20대,이재명,인맥주,2022-02-05,2022-03-16
오리엔트바이오,002630,2022-02-10,흠,cdh1****,더럽게 눌러네 여기가 바닥이긴 한거같은데 ㅎㅎ,[],175,3,0,https://finance.naver.com/item/board_read.naver?code=002630&nid=213573559&st=&sw=&page=851,20대,이재명,인맥주,2022-02-05,2022-03-16
오리엔트바이오,002630,2022-02-10,chan**** 및 그외 종자들 보아라,jybk****,주둥아리로 악플만 달지말고 가지고 있는거 풀어서 좀 내려봐라~~ 대차를 하든~~ 그래야 니들 말이 맞다 그러지~~ 안내려가서 주둥아리로 떠들어 봐야 더이상 안내려간다. 그럴 능력없으면 조용히 살아라 다른 사람 열받게 하지말고~~ 양아치 ?끼들 ~~,[],224,8,0,https://finance.naver.com/item/board_read.naver?code=002630&nid=213558154&st=&sw=&page=851,20대,이재명,인맥주,2022-02-05,2022-03-16
오리엔트바이오,002630,2022-02-10,chan**** 및 그외 종자들 보아라,cdh1****,찬성,[],104,0,0,https://finance.naver.com/item/board_read.naver?code=002630&nid=213573781&st=&sw=&page=852,20대,이재명,인맥주,2022-02-05,2022-03-16
오리엔트바이오,002630,2022-02-10,찬이 요즘 게을러,ko******,찬아1000원 아래로 언제 떨굴래 1000원 아래 매수 대기중인데 기다리기 지겹다,[],178,3,0,https://finance.naver.com/item/board_read.naver?code=002630&nid=213554265&st=&sw=&page=852,20대,이재명,인맥주,2022-02-05,2022-03-16
오리엔트바이오,002630,2022-02-10,찬이 요즘 게을러,jybk****,그놈은 물에 빠져도 절대 죽지 않을것 같음. 주둥아리가 가벼워 물에 둥둥 떠다닐거임 쓸데없는 소리 하지말고 한강가랬는데 갔다왔는지 안갔다왔는지는 모르겠으나 분명한 것은 절대 안죽을것같음. 느낌상~~ chan***아~~ 한강 행주대교 가서 실험해봐~~ 꼭 다리위에서 뛰어 내려야 한다~~,[],107,1,0,https://finance.naver.com/item/board_read.naver?code=002630&nid=213585330&st=&sw=&page=852,20대,이재명,인맥주,2022-02-05,2022-03-16
오리엔트바이오,002630,2022-02-10,오늘도 허경영 응원~,skt5****,허경영 당선되면 유전자가위 관련주 100배갑니다! 허경영 화이팅!,[],126,0,3,https://finance.naver.com/item/board_read.naver?code=002630&nid=213551297&st=&sw=&page=852,20대,이재명,인맥주,2022-02-05,2022-03-16
오리엔트바이오,002630,2022-02-10,[삭제된 게시물의 답글]이시키 주는 왜이래,jybk****,안가는데?? 되려 떨어지는데??~~ 덕성?? 쳐박고 있는거 안보이나?? 그리고 거기가서 놀지?? 왜? 여기서 욕하면 너 인간성 더러워져~~ 답변하는 나도 괴롭고~~ 제발 사라져라~~ 좀~~ 나도 편하게 살자,[],158,6,1,https://finance.naver.com/item/board_read.naver?code=002630&nid=213555779&st=&sw=&page=852,20대,이재명,인맥주,2022-02-05,2022-03-16
오리엔트바이오,002630,2022-02-10,나도 징글징글,seal****,많은 분들이 실망할 때가 기회일 수 있지 않겠는가 기대해보자 화이링~~~ 찬 돌이는 토건에서 오늘 하한가 맞겠네 꼴랑 1주 가지고 울지는 마라 알것제,[],218,4,1,https://finance.naver.com/item/board_read.naver?code=002630&nid=213528476&st=&sw=&page=852,20대,이재명,인맥주,2022-02-05,2022-03-16
오리엔트바이오,002630,2022-02-09,징글징글,haha****,종목 토론방에 종목 얘기는 없고 정치 얘기만 징글징글,['진짜 징그럽게 정치적 무슨생각 인지?'],201,8,1,https://finance.naver.com/item/board_read.naver?code=002630&nid=213518709&st=&sw=&page=852,20대,이재명,인맥주,2022-02-05,2022-03-16
오리엔트바이오,002630,2022-02-09,ㅎㅎ,cdh1****,내일 오르겠지? 그렇게 믿으면서 하루하루를즐깁니다 ㅎㅎ,[],186,7,0,https://finance.naver.com/item/board_read.naver?code=002630&nid=213506488&st=&sw=&page=852,20대,이재명,인맥주,2022-02-05,2022-03-16
오리엔트바이오,002630,2022-02-09,[삭제된 게시물의 답글]아무와 단일화 해도 이재망은 낙선으로 나타남,cdh1****,내일 많이 올려칠거요 ㅎㅎ 기대해보셔,['응 떡락이야'],145,5,0,https://finance.naver.com/item/board_read.naver?code=002630&nid=213511546&st=&sw=&page=852,20대,이재명,인맥주,2022-02-05,2022-03-16
오리엔트바이오,002630,2022-02-09,[삭제된 게시물의 답글]아무와 단일화 해도 이재망은 낙선으로 나타남,jybk****,나랑 내기 할래?? 양아 ?끼야~~ 오늘 니들 말믿고 밑으로 십이만주 깔아놨는데 한 주도 안걸렸네 근데 내일??~~에라이 양아 ?끼들 떡락하면 내가 사라진다. 오르면 유언비어 유포하지말고 사라져라~~ 왜이리 알바 ?끼 교육도 안시키고 썩은 소리만 해도 돈주는 ?끼는 어디서 뭐하는 ?끼인지 모르것네~~ 다리 밑에 뚝 떨어진 ?끼들~~ 나~~ 참~~,[],102,2,0,https://finance.naver.com/item/board_read.naver?code=002630&nid=213515433&st=&sw=&page=852,20대,이재명,인맥주,2022-02-05,2022-03-16
오리엔트바이오,002630,2022-02-09,[삭제된 게시물의 답글]아무와 단일화 해도 이재망은 낙선으로 나타남,cdh1****,왜열받고그려 올르면좋고 안오르면 오르는날있것제 나는 장투라 신경 안써 다만 오를때가 ?지않나하는 거지 그렇게 주식할라면 하지마셔 ㅎㅎ 정신건강에 안좋아,[],111,3,0,https://finance.naver.com/item/board_read.naver?code=002630&nid=213516376&st=&sw=&page=852,20대,이재명,인맥주,2022-02-05,2022-03-16
오리엔트바이오,002630,2022-02-09,혜경궁 사과??? 저게 사과 ? ?,chan****,머징? 사과 했는데 저게 사과? ? ? 어떤점 사과 질문에 . 수사. 감사 협조하겠다. ㅋㅋ 이게 사과 냐ㅋㅋㅋㅋ 국민 조롱하너ㅋㅋㅋ 뉴스 막 때린다ㅋㅋㅋㅋ 일 더 커지겠다ㅋ 전문가들 안한것보다 못하다ㅋㅋ 말하는데,"['거니가 혼자 영화찍다 역풍불었잖니 사과의 정석 혜겸님 넘 멋있어요 찬이는 댓구부대 일베 가 확실하네 요번에 국짐애들 댓글부대 잡았잖아 너도 조만간이네? 얘는진짜 치졸한게 불리하면 댓삭 하더라? 난다 찍어뒀는데 ㅋㅋ 이번것도 지워봐?', '소고기로 찬이 때리고 싶다..', '사과할거면 제대로 해야지 저게 무슨 사과임 죄 밝혀지면 한다는거잖아', '자가격리중 소고기 배달시켜 처먹었다함 소고기로 귀싸대기 맞아야함', '그래. 웃긴다. 너갇은 애들이 주절거리는게 넘 웃겨. 이제 됐냐,.?', '웃기지 않아? 찬티야ㅋ 지금 뉴스봐ㅋ 막 때린다ㅋ', '너가 나중에 사죄 마니 해야것다. 아그야.']",272,0,15,https://finance.naver.com/item/board_read.naver?code=002630&nid=213498116&st=&sw=&page=852,20대,이재명,인맥주,2022-02-05,2022-03-16
오리엔트바이오,002630,2022-02-09,[삭제된 게시물의 답글][삭제된 게시물의 답글]혜경궁 사과??? 저게 사과 ? ?,jybk****,이 ?끼 또 지가 쓴 글 댓글다니 삭제했네~~ 양아 ?끼야 ~~ 쪽팔리는건 아냐~~ 양심은 없어도??~~ 형이 말했지~~ 이 악플러 양아 ?끼야 ~~ 너는 잔돈 벌려고 이런짓 하는지 몰라도 다른 사람 마음 상해서 괴로운건 관심없지? 그러다 너 진짜 피똥싼다~~ 그니까 그만해라~~ 양아 ?끼야 ~~ 적어도 인간탈 쓰고 나온 놈이라면 이럼 안된다~~ 장난으로 돌던지겠지만 개구리 맞으면 죽는다.모르냐??~~ 그럼 니가 개구리 할래?? 난 상관없지만~~,[],90,2,0,https://finance.naver.com/item/board_read.naver?code=002630&nid=213515179&st=&sw=&page=852,20대,이재명,인맥주,2022-02-05,2022-03-16
오리엔트바이오,002630,2022-02-09,[삭제된 게시물의 답글][삭제된 게시물의 답글]혜경궁 사과??? 저게 사과 ? ?,cdh1****,그건 그렇지 ㅎㅎ,[],118,1,0,https://finance.naver.com/item/board_read.naver?code=002630&nid=213506553&st=&sw=&page=852,20대,이재명,인맥주,2022-02-05,2022-03-16
오리엔트바이오,002630,2022-02-09,[삭제된 게시물의 답글]중국어선 이재망 격침 해야한다ㅋ 지금 날리다ㅋ,jybk****,형이 말했지~~ 이 악플러 양아 ?끼야 ~~ 너는 잔돈 벌려고 이런짓 하는지 몰라도 다른 사람 마음 상해서 괴로운건 관심없지? 그러다 너 진짜 피똥싼다~~ 그니까 그만해라~~ 양아 ?끼야 ~~ 적어도 인간탈 쓰고 나온 놈이라면 이럼 안된다~~ 장난으로 돌던지겠지만 개구리 맞으면 죽는다.모르냐??~~ 그럼 니가 개구리 할래?? 난 상관없지만~~,[],203,11,0,https://finance.naver.com/item/board_read.naver?code=002630&nid=213468280&st=&sw=&page=852,20대,이재명,인맥주,2022-02-05,2022-03-16
오리엔트바이오,002630,2022-02-09,[삭제된 게시물의 답글]중국어선 이재망 격침 해야한다ㅋ 지금 날리다ㅋ,jybk****,윤후보 선제 타격은?? 참 징그럽다~~,[],135,4,0,https://finance.naver.com/item/board_read.naver?code=002630&nid=213489754&st=&sw=&page=852,20대,이재명,인맥주,2022-02-05,2022-03-16
오리엔트바이오,002630,2022-02-09,찬 돌아 남자 아이네,seal****,실명 까고 맞춤법 바로 적어라 넘 좋은 정보를 그런 식으로 아님말고 식으로 올리면 섭섭하다 아이가 맞춤법과 이름 함 바로 적어라 남자답게 맨날 쪼잔하게 살지말고 알겠지 찬~~~~~,"['찬 돌아 ...ㅋㅋ..삼부..썩렬이와 동서지간이네...ㅎㅎ...니는 몇번째 남자냐??', '부들부들 거리지망ㅋㅋ 끝난 주식이얍ㅋ 형아 삼부 쭉쭉 올라간다ㅋㅋㅋㅋ 신낫졍 3년 장기투자 인데 쭉쭉 올라갓졍 히힛']",325,6,0,https://finance.naver.com/item/board_read.naver?code=002630&nid=213438781&st=&sw=&page=852,20대,이재명,인맥주,2022-02-05,2022-03-16
오리엔트바이오,002630,2022-02-09,오늘도 허경영 응원한다,skt5****,허경영 당선되면 유전자가위기술주 떡상! 100배갑니다 이번에는 마지막 기회라 생각하고 허경영에 올인합니다 오늘도 허경영 응원합니다!~ 당선시 1억주는 허경영.,[],230,1,2,https://finance.naver.com/item/board_read.naver?code=002630&nid=213421398&st=&sw=&page=852,20대,이재명,인맥주,2022-02-05,2022-03-16
오리엔트바이오,002630,2022-02-09,신기하네,ul******,"대선정국시작한 이후, 이재명 지지율 차트와 오리엔트바이오 가격의 차트를 동시에 놓고 비교를 해서 보면 개미꼬셔서 죽이기 외에는 의미있는 결론을 내기 어려울텐데 지지율근황은 끊임없이 올라오네. 이분들은 객관적인 논리전개 대신 마음의 위로와 정신적 합리화가 더 중요한건가? 투자 그렇게하는거 아닌데~",['동의 합니다'],389,8,4,https://finance.naver.com/item/board_read.naver?code=002630&nid=213417321&st=&sw=&page=852,20대,이재명,인맥주,2022-02-05,2022-03-16
오리엔트바이오,002630,2022-02-09,아 이재명씨는 ..안챙겨 줄거 같아서 안올리는듯..삼부토건 한번 보세요들..,bk******,아..석렬이..,['우리 재명이 아저씬 너무 깨끗해서...'],229,0,0,https://finance.naver.com/item/board_read.naver?code=002630&nid=213416758&st=&sw=&page=852,20대,이재명,인맥주,2022-02-05,2022-03-16
오리엔트바이오,002630,2022-02-09,손가락 아작나길,seal****,지금 딱 이 시점에 저 넘들 손가락이 아작나길 바랄 뿐 제발 아작나라 화리링~~~~,[],222,3,0,https://finance.naver.com/item/board_read.naver?code=002630&nid=213412923&st=&sw=&page=853,20대,이재명,인맥주,2022-02-05,2022-03-16
오리엔트바이오,002630,2022-02-09,[삭제된 게시물의 답글]찬돌아 너무 좋네..ㄷㄷ화천대유 이재망 선거 3억 남욱 증언ㄷㄷㄷ,seal****,실명으로 맞춤법 맞게 올려라...ok?!,[],255,4,0,https://finance.naver.com/item/board_read.naver?code=002630&nid=213408533&st=&sw=&page=853,20대,이재명,인맥주,2022-02-05,2022-03-16
오리엔트바이오,002630,2022-02-08,ㅎㅎ,cdh1****,내일 크게 한번뛰어줄거같은데 ㅎㅎ 내촉을 한번 믿어본다 그래 갈때도?지 저혼자만의 생각일 뿐입니다 ㅎㅎ,"['동전주입성~', '? 님 러시아 전쟁 보고오세요ㅋ 아시아증시 폭락합니다']",415,10,2,https://finance.naver.com/item/board_read.naver?code=002630&nid=213401930&st=&sw=&page=853,20대,이재명,인맥주,2022-02-05,2022-03-16
오리엔트바이오,002630,2022-02-08,ㅎㅎ,cdh1****,물도못타게 찔끔찔끔 빼네 팍 빼던지 아님 쳐올리던지 ㅎㅎ 지금내가 누구한테 야그하는겨? 정신줄 놓지말자 ㅎㅎ 낼은 얼마더빠질라나 흠,[],199,3,0,https://finance.naver.com/item/board_read.naver?code=002630&nid=213393785&st=&sw=&page=853,20대,이재명,인맥주,2022-02-05,2022-03-16
오리엔트바이오,002630,2022-02-08,고수님들 공시 ? 설명좀 해주세요,bk******,오늘 뭔가 수정공시가 떳네요.. 투자자?,"['오리엔트 자회사를 매수한 상대방은 Envigo 하나 입니다. Inotiv는 매수자가 아니고 오리엔트가 매각대금의 일부로 받은 주식이 Inotiv 주식이죠..', '마지막보면 당기순이익도큼. 그런데 참고할건 이놈은 개잡주임. 현금600억이생기나 당기순이익이 수십억생기나 주가는쓰레기 개잡주 ㅋㅋ']",585,7,1,https://finance.naver.com/item/board_read.naver?code=002630&nid=213387383&st=&sw=&page=853,20대,이재명,인맥주,2022-02-05,2022-03-16
오리엔트바이오,002630,2022-02-08,꼭 봐야하는 젊은시절 허경영 영상,skt5****,https://www.youtube.com/shorts/l7blTgvMqyQ 30년전 영상인가? 무척 젊을때의 아주 포스가 있고 멋진 허경영 연설 영상인데 학벌주의가 와서 0.5% 엘리트들이 대한민국을 지배하기 때문에 자기들만 먹고사는 공산당이 된다고 합니다. 허경영은 앞으로 0.5%엘리트들과 자신이 붙는다고 하네요. 엄청 멋진 영상입니다 . 꼭 보세요,"['멍청하고 돈없는 서민들은 무슨말인줄 멀라요~이죄명,윤도리도리,간철수 밖에 멀라요~', '이런소리 나두 30년전 예측하고 있었어..']",206,1,2,https://finance.naver.com/item/board_read.naver?code=002630&nid=213377037&st=&sw=&page=853,20대,이재명,인맥주,2022-02-05,2022-03-16
오리엔트바이오,002630,2022-02-08,찬아 수고가 많다,king****,이재명 안티질하려고 고생이 많네 계속해도 되는데 그것만 알아 윤석열 아무리 니가 시부린다해도 킹이 못되 why? 그건 니가 이재명 당선되고 느끼면 되는부분이고~ 이재명 당선되면 너는 그럼 누구 안티할래???ㅎㅎ 설민심에서 이미 이재명 당선확정이야 그리고 제발 부탁하는데 쓰잘데기 없는 대장동/김혜경/형수욕설 내용으로 안티하지마 부탁이야 그게 중요해?? 니 밥쳐먹는거랑 니 살고있는 집이랑 니 입고 있는 옷에 대해 현실적인 토론을 해야할때야 지금은 그게 대통령 자질에 문제가 된다면 더더욱 중요하지 않고 우리나라 역대 킹들과 국개의원 털어봐 이보다 더하면 더했지 덜하진 않을거야 그러니까 안티하는건 다 좋은데 3월8일까지만해 알았지??? 어차피 대통령은 이재명이야 그리고 여기 종토방에서 정치관련얘기 앞으로 하지말자~,['빙고'],296,18,2,https://finance.naver.com/item/board_read.naver?code=002630&nid=213358696&st=&sw=&page=853,20대,이재명,인맥주,2022-02-05,2022-03-16
오리엔트바이오,002630,2022-02-08,손절할까 말까 고민중.,leev****,주담 얘기듣구 버티고 버틴결과 마이너스34%로 오바호구들....개미...,"['주담이 머시라고 꼬셨는디? 이바구좀 풀어바?', '주담꼬임에 당했네 ㅋㅋㅋㅋ']",343,1,1,https://finance.naver.com/item/board_read.naver?code=002630&nid=213355489&st=&sw=&page=853,20대,이재명,인맥주,2022-02-05,2022-03-16
오리엔트바이오,002630,2022-02-08,chan 및 그 외 종자들,jybk****,안빠지네~~ 폭락이라며~~ 니들이 요령 부족이냐~~ 교육 부족이냐~~ 좀 더 입에 거품 물어야 쓰것다. 니들 말로 적정 주가 700원?? 600원?? 하여간에 오만가지 썰풀어서 좀 내려 봐~~ 형 심심해 죽겄다. 내리면 줍줍 할려는데 기다리기 지친다. 쪼매만 더 입에 거품물고 부들부들해봐~~ 형이 기다린다~~,['이죄명 혜경궁 비리하나 물어와봐그럼 하한가로 보낼수 있다'],226,6,0,https://finance.naver.com/item/board_read.naver?code=002630&nid=213345640&st=&sw=&page=853,20대,이재명,인맥주,2022-02-05,2022-03-16
오리엔트바이오,002630,2022-02-08,chan 및 그 외 종자들,jybk****,멍석 깔아줬는데 못하면 너그들은 완전 쪼다 ?끼들이다. 부지런히 해봐~~,[],158,2,0,https://finance.naver.com/item/board_read.naver?code=002630&nid=213349055&st=&sw=&page=853,20대,이재명,인맥주,2022-02-05,2022-03-16
오리엔트바이오,002630,2022-02-08,오늘 매수 타이밍....,chsl****,닥치고 매수....,"['연기금매수중', '띤따로', 'ㅋㅋㅋ 매수할 돈은 있고.....? ㅋㅋㅋ']",450,8,3,https://finance.naver.com/item/board_read.naver?code=002630&nid=213315345&st=&sw=&page=853,20대,이재명,인맥주,2022-02-05,2022-03-16
